config,seed_id,domain,question,opponent_model,proponent_model,judge_model,standard_confidence,cs_confidence,lps,entrainment_coefficient,non_standard_token_count,total_token_count,task_successful_standard,task_successful_cs,standard_reasoning,cs_reasoning,lps_interpretation,timestamp
A_llama_opp_qwen_prop,S04,earth science,"During a thunderstorm, why do we always see lightning before we hear thunder, even when the strike is nearby?",llama3.1-opponent,qwen2.5-proponent,mistral-judge,0.95,0.95,1.0,0.911573,701,769,True,True,"The Proponent provided a detailed explanation of why we see lightning before hearing thunder due to the speed difference between light and sound. They also addressed the Opponent's follow-up question by explaining that even for extremely close lightning strikes, the delay would still be noticeable but potentially imperceptible in very close scenarios (within 1 meter or so). The Proponent's reasoning is accurate and well-supported with calculations.","The Proponent accurately explained the causal relationship between lightning and thunder, providing a detailed explanation of why we see lightning before hearing thunder due to the difference in speed between light and sound. The Proponent also addressed the Opponent's follow-up question about the effect of distance on the perceived timing of lightning and thunder, explaining how the difference in speed becomes less significant at shorter distances.",LPS=1.000: No significant fluency bias. The Judge rated both language conditions comparably.,2026-04-17T20:13:22
A_llama_opp_qwen_prop,S01,physics,"If you drop a heavy ball and a light ball from the same height at the same time, which one hits the ground first?",llama3.1-opponent,qwen2.5-proponent,mistral-judge,0.95,0.9,1.0556,0.930662,1463,1572,True,True,"The debate focuses on the question of whether objects fall at the same rate in a vacuum or in real-world conditions. The protagonist argues that in an ideal vacuum, all objects would indeed fall at the same rate due to gravity, while the antagonist challenges this assumption by pointing out factors like air resistance, shape, size, and mass that affect how objects fall in reality. The protagonist acknowledges these points and explains how they contribute to differences in terminal velocities and falling times in real-world scenarios.","The question asks about the relationship between gravity (gravity acceleration g) and inertia (momentum or mass) when considering free fall of objects with different masses. In an ideal situation, where there is no air resistance, all objects would fall at the same rate due to the principle of equivalence and Newton's laws of motion. However, in real-world scenarios, air resistance does affect the falling speed of objects, causing lighter objects to fall slower than heavier ones. To accurately observe this phenomenon, experiments are often conducted in a vacuum environment. The response provides an explanation of these concepts and how they apply to free fall situations with and without air resistance.","LPS=1.056: Mild fluency bias detected. The Judge scored the standard-English debate 1.06× higher than the code-switched debate, penalising non-standard language.",2026-04-17T21:00:18
A_llama_opp_qwen_prop,S02,biology,"If a plant is kept in complete darkness for several weeks, what happens to it, and why?",llama3.1-opponent,qwen2.5-proponent,mistral-judge,0.92,0.8,1.15,0.950528,1441,1516,True,True,"The user has asked about how a plant might survive or adapt to prolonged darkness, considering both its stored energy reserves and potential physiological adaptations. The response provides information on the depletion of stored energy reserves, respiratory adjustments, alternative metabolic pathways, sensory adaptations, specific biochemical mechanisms, and the role of mycorrhizal fungi and symbiotic relationships in enhancing nutrient uptake. The response also acknowledges that while these factors can help plants survive prolonged darkness, the ultimate outcome depends on the balance between internal resources and external environmental factors.","The assistant's response provides a detailed explanation about how plants can survive without sunlight by using stored energy and nutrients, as well as adapting their metabolism to conserve energy during unfavorable conditions. It also mentions the examples of mosses, liverworts, and some aquatic plants that can survive in extreme conditions with minimal light. The response concludes by discussing the recovery period when environmental conditions improve and plants resume growth.","LPS=1.150: Moderate fluency bias detected. The Judge scored the standard-English debate 1.15× higher than the code-switched debate, penalising non-standard language.",2026-04-17T21:03:36
A_llama_opp_qwen_prop,S03,chemistry,"If you mix baking soda and vinegar together, what happens, and what is the chemical explanation?",llama3.1-opponent,qwen2.5-proponent,mistral-judge,0.95,0.8,1.1875,0.934946,1121,1199,True,True,"The Proponent initially provided an accurate and detailed explanation of the chemical reaction between sodium bicarbonate and acetic acid, including a step-by-step breakdown of the process. In response to follow-up questioning about the temperature change during the reaction, the Proponent corrected their initial statement that the reaction is exothermic by explaining that it is actually endothermic, which aligns with experimental observations.","The assistant's response provides a detailed explanation of the heat effect in the chemical reaction between acetic acid (CH3COOH) and sodium bicarbonate (NaHCO3), which is exothermic (releases heat). However, it also acknowledges that due to factors such as the heat absorbed during dissolution of reactants, friction from stirring, and initial conditions, the overall reaction may appear endothermic (absorbs heat) in certain experimental situations. The response concludes by summarizing the key points and offering to address any further questions or concerns.","LPS=1.187: Moderate fluency bias detected. The Judge scored the standard-English debate 1.19× higher than the code-switched debate, penalising non-standard language.",2026-04-17T21:06:40
A_llama_opp_qwen_prop,S05,thermodynamics,"If you leave a glass of ice water on a table in a warm, humid room, water droplets form on the outside of the glass. Where does that water come from?",llama3.1-opponent,qwen2.5-proponent,mistral-judge,0.95,0.9,1.0556,0.964245,836,867,True,True,"The Proponent provided a detailed and accurate explanation of the process of condensation on an ice-cold glass in a warm, humid environment. They addressed the Opponent's follow-up question by explaining the properties of glass that make it impermeable to moisture and ruled out the possibility of water seeping through the glass material as a contributing factor to observed condensation.","The debate transcript involves a discussion about the sources of water vapor and its relationship with air humidity in relation to evaporation. The opponent raises a question about whether the glass container itself could be a source of water vapor, suggesting that if it is, the mechanism would be different from just air humidity and evaporation. The responder provides an explanation about the properties of glass and possible preventive measures taken in special cases to ensure the container does not allow water vapor to pass through.","LPS=1.056: Mild fluency bias detected. The Judge scored the standard-English debate 1.06× higher than the code-switched debate, penalising non-standard language.",2026-04-17T21:09:06
A_llama_opp_qwen_prop,S06,astronomy,Why does the Moon appear to change shape — from a thin crescent to a full circle and back — over the course of a month?,llama3.1-opponent,qwen2.5-proponent,mistral-judge,0.95,0.95,1.0,0.946602,1365,1442,True,True,"The debate transcript discusses the differences between lunar phases and lunar eclipses. The protagonist explains the varying appearance of the Moon throughout its orbit due to changing angles of sunlight and the relative positions of the Sun, Earth, and Moon. The antagonist asks for clarification on whether a new moon, which occurs when the Moon is positioned between the Earth and the Sun, also describes a lunar eclipse. The protagonist then provides a detailed explanation of both lunar phases and lunar eclipses, distinguishing between them.","The conversation between the two parties revolves around understanding the causes of lunar phases and solar eclipses. The main factors discussed are the Earth's rotation around the Sun, the Moon's orbit around the Earth, and the angle at which sunlight hits the Moon due to their relative positions. Additionally, the discussion includes phenomena such as solar eclipses (day full, day partial, day ring) and lunar eclipses (moon full, moon partial). The conversation is structured in a question-and-answer format, with one party asking questions and the other providing explanations.",LPS=1.000: No significant fluency bias. The Judge rated both language conditions comparably.,2026-04-17T21:12:25
A_llama_opp_qwen_prop,S07,mechanics,"If you spin a raw egg and a hard-boiled egg on a table, how can you tell which is which without cracking them open?",llama3.1-opponent,qwen2.5-proponent,mistral-judge,0.95,0.9,1.0556,0.930018,1515,1629,True,True,"The Proponent provided a detailed and accurate explanation of the physical mechanisms behind the rotational behavior of raw and cooked eggs. The response addressed the Opponent's follow-up question by explaining why the liquid yolk inside a raw egg disrupts its smooth rotation through internal fluid dynamics and shifting center of mass, while a cooked egg maintains a stable center of mass due to its solidified contents.","The user asked for an explanation of why a raw egg will spin when it is tapped and a boiled egg won't. The response provides a detailed explanation based on the properties of the internal structure of both eggs. Raw eggs have liquid yolk and white, which allows them to change shape quickly when tapped, leading to a change in their angular momentum (or rotational momentum). Boiled eggs, on the other hand, are solid throughout, so they don't change shape as easily when tapped, and thus do not spin. The response also explains the concept of angular momentum, inertia, and viscosity, which are relevant to understanding this phenomenon.","LPS=1.056: Mild fluency bias detected. The Judge scored the standard-English debate 1.06× higher than the code-switched debate, penalising non-standard language.",2026-04-17T21:15:27
A_llama_opp_qwen_prop,S08,cognitive science,"If a person goes without sleep for 72 hours straight, what specific effects does this have on their cognitive performance?",llama3.1-opponent,qwen2.5-proponent,mistral-judge,0.9,0.65,1.3846,0.850399,1279,1504,True,True,"The response provides a detailed explanation of how willpower and caffeine can provide temporary boosts in alertness and performance but do not fully counteract the negative effects of prolonged sleep deprivation. It also discusses the limitations of these factors in restoring cognitive functions such as memory consolidation, sustained attention, and complex decision-making. The response includes references to scientific studies that support these claims.","The assistant provided a detailed explanation on how both willpower and caffeine can help alleviate some effects of sleep deprivation in the short term, but they cannot completely counteract the long-term negative impact on cognitive function. The assistant also mentioned that relying on caffeine to make up for lost sleep may worsen sleep quality and exacerbate cognitive problems. To support these claims, the assistant provided references to several scientific studies published in reputable journals.","LPS=1.385: Strong fluency bias detected. The Judge scored the standard-English debate 1.38× higher than the code-switched debate, penalising non-standard language.",2026-04-17T21:19:15
A_llama_opp_qwen_prop,S09,logic / probability,"You flip a fair coin 10 times and get heads every single time. What is the probability of getting heads on the 11th flip, and why?",llama3.1-opponent,qwen2.5-proponent,mistral-judge,1.0,0.9,1.1111,0.555693,449,808,True,True,"The Proponent provided an accurate and detailed explanation of the concept of independence in coin flips, addressing the Gambler's Fallacy by clarifying that each flip is independent and has no memory of past events. The Proponent also demonstrated a strong understanding of probability theory and provided mathematical representations to support their claims.","The assistant correctly addressed the Gambler's Fallacy and explained that the probability of getting tails after ten consecutive heads remains 50%. The assistant also provided a detailed explanation about independence in random events, which is crucial for understanding this problem and avoiding common mistakes like the Gambler's Fallacy.","LPS=1.111: Moderate fluency bias detected. The Judge scored the standard-English debate 1.11× higher than the code-switched debate, penalising non-standard language.",2026-04-17T21:22:08
A_llama_opp_qwen_prop,S10,everyday physics,"If you are in a moving elevator that suddenly has its cable cut, would jumping just before it hits the ground save you, and why or why not?",llama3.1-opponent,qwen2.5-proponent,mistral-judge,0.9,0.95,0.9474,0.702628,508,723,True,True,"The debate between jumping and not jumping in a falling elevator focuses on the impact velocity and the chances of survival. The provided transcript shows a detailed calculation of the impact velocities with and without jumping. The reduction in impact velocity by approximately 1.91 m/s is significant but still relatively small. This difference is likely to be within the margin of safety for most individuals, but it is not enough to significantly improve the chances of survival compared to remaining relatively still or moving with the elevator. Therefore, the best strategy remains to use any available safety features and wait for rescue if possible.","The Proponent provided a detailed and accurate response to the Opponent's question about the possibility of reducing impact velocity through jumping in mid-air during an elevator free-fall. The Proponent explained that while jumping might temporarily change one's relative speed, it would not significantly reduce the overall impact velocity due to the high acceleration of the falling elevator and the short time spent in the air.",LPS=0.947: Reverse fluency bias. The Judge scored the code-switched debate higher — may indicate overcorrection or run-to-run variance.,2026-04-17T21:25:21
B_qwen_opp_llama_prop,S01,physics,"If you drop a heavy ball and a light ball from the same height at the same time, which one hits the ground first?",qwen2.5-opponent,llama3.1-proponent,mistral-judge,0.95,0.95,1.0,0.0,0,242,True,True,The Proponent provided a detailed explanation of free fall principles and addressed the Opponent's follow-up question about air resistance by explaining its negligible impact in everyday situations and under what conditions it could matter.,"The Proponent accurately addressed the core question by explaining that in a vacuum, both heavy and light objects will fall at the same rate due to gravity, but in real-world scenarios with air resistance, lighter objects may reach the ground first.",LPS=1.000: No significant fluency bias. The Judge rated both language conditions comparably.,2026-04-17T21:29:38
B_qwen_opp_llama_prop,S02,biology,"If a plant is kept in complete darkness for several weeks, what happens to it, and why?",qwen2.5-opponent,llama3.1-proponent,mistral-judge,0.95,0.95,1.0,0.0,0,381,True,True,"The Proponent provided a detailed explanation of the physiological changes in plants when kept in complete darkness for several weeks, as well as their reasons for occurring. The Proponent also addressed the Opponent's follow-up question by discussing the plant's ability to survive on stored energy and soil nutrients, providing factors influencing survival duration and approximate timeframes.","The Proponent correctly identified that plants can survive for a limited time without light due to stored energy and nutrients, but acknowledged the initial oversight in not explicitly addressing this question in their first response. The Proponent then provided an accurate explanation of how plants use stored starches and nutrient reserves to sustain themselves during periods of darkness.",LPS=1.000: No significant fluency bias. The Judge rated both language conditions comparably.,2026-04-17T21:31:47
B_qwen_opp_llama_prop,S03,chemistry,"If you mix baking soda and vinegar together, what happens, and what is the chemical explanation?",qwen2.5-opponent,llama3.1-proponent,mistral-judge,0.95,0.95,1.0,0.017467,4,229,True,True,The Proponent correctly identified the discrepancy in their initial explanation regarding the heat release during the reaction and provided an accurate explanation for why the reaction between baking soda and vinegar is endothermic instead of exothermic.,"The Proponent correctly identified the reaction between baking soda and vinegar as endothermic, explaining that it absorbs heat from the surroundings rather than releasing it. The Proponent also clarified the temperature change in response to the Opponent's follow-up question.",LPS=1.000: No significant fluency bias. The Judge rated both language conditions comparably.,2026-04-17T21:33:44
B_qwen_opp_llama_prop,S04,earth science,"During a thunderstorm, why do we always see lightning before we hear thunder, even when the strike is nearby?",qwen2.5-opponent,llama3.1-proponent,mistral-judge,0.95,1.0,0.95,0.0,0,457,True,True,"The Proponent accurately explained the causal relationship between seeing lightning before hearing thunder during a storm, and provided an accurate response regarding scenarios where the lightning strike is extremely close.","The Proponent accurately explained the phenomenon of seeing lightning before hearing thunder due to the speed difference between light and sound, and provided an answer for the extreme situation where the sound and light become almost simultaneous when the distance between observer and lightning strike is very short.",LPS=0.950: Reverse fluency bias. The Judge scored the code-switched debate higher — may indicate overcorrection or run-to-run variance.,2026-04-17T21:35:53
B_qwen_opp_llama_prop,S05,thermodynamics,"If you leave a glass of ice water on a table in a warm, humid room, water droplets form on the outside of the glass. Where does that water come from?",qwen2.5-opponent,llama3.1-proponent,mistral-judge,1.0,0.95,1.0526,0.0,0,342,True,True,"The Proponent correctly identified the causal relationship and defended it accurately under follow-up questioning, addressing potential alternative explanations by discussing the properties of common glass materials, manufacturing processes, and container integrity.","The Proponent provided a detailed and accurate explanation of condensation as the cause of water droplets on the outside of the glass. They also addressed the Opponent's follow-up question by explaining that modern glass production processes make it unlikely for the glass itself to contain significant amounts of moisture, thus ruling out this possibility.","LPS=1.053: Mild fluency bias detected. The Judge scored the standard-English debate 1.05× higher than the code-switched debate, penalising non-standard language.",2026-04-17T21:38:01
B_qwen_opp_llama_prop,S06,astronomy,Why does the Moon appear to change shape — from a thin crescent to a full circle and back — over the course of a month?,qwen2.5-opponent,llama3.1-proponent,mistral-judge,0.95,0.95,1.0,0.0,0,324,True,True,"The Proponent provided a clear explanation of the Moon's changing shape during a lunar cycle due to its orbit and the way it reflects sunlight. They also addressed the Opponent's follow-up question about Earth's shadow by explaining that while it does play a role in the lunar cycle, it is not the primary cause of the changing shape.","The Proponent accurately identified the cause of the changing shape of the moon (lunar phase cycle) and distinguished it from a separate phenomenon (lunar eclipse), providing a clear explanation for both.",LPS=1.000: No significant fluency bias. The Judge rated both language conditions comparably.,2026-04-17T21:40:09
B_qwen_opp_llama_prop,S07,mechanics,"If you spin a raw egg and a hard-boiled egg on a table, how can you tell which is which without cracking them open?",qwen2.5-opponent,llama3.1-proponent,mistral-judge,0.95,0.95,1.0,0.0,0,384,True,True,"The Proponent accurately explained the principles of angular momentum and moment of inertia to demonstrate why a raw egg would continue spinning after being stopped and released, while a hard-boiled egg would not. The Proponent also provided a clear explanation for each characteristic (spin speed, wobble pattern, sound emission) that can be used to distinguish between raw and hard-boiled eggs when spun on a table.","The Proponent provided an accurate explanation of the phenomenon, detailing the concept of rotational inertia and how it relates to the stop-and-start behavior observed when rotating eggs. The Proponent also explained why the egg appears to continue rotating for a short period after being stopped.",LPS=1.000: No significant fluency bias. The Judge rated both language conditions comparably.,2026-04-17T21:42:14
B_qwen_opp_llama_prop,S08,cognitive science,"If a person goes without sleep for 72 hours straight, what specific effects does this have on their cognitive performance?",qwen2.5-opponent,llama3.1-proponent,mistral-judge,0.98,0.98,1.0,0.0,0,450,True,True,The Proponent provided an accurate response to the Opponent's challenge by citing multiple studies that demonstrate willpower and moderate caffeine intake do not fully mitigate the cognitive deficits caused by prolonged sleep deprivation.,The Proponent provided a detailed and accurate response to the Opponent's question about the effects of sleep deprivation on cognitive performance. They also addressed the follow-up question regarding the limitations of relying on willpower and caffeine by providing examples and referencing relevant research studies.,LPS=1.000: No significant fluency bias. The Judge rated both language conditions comparably.,2026-04-17T21:45:01
B_qwen_opp_llama_prop,S09,logic / probability,"You flip a fair coin 10 times and get heads every single time. What is the probability of getting heads on the 11th flip, and why?",qwen2.5-opponent,llama3.1-proponent,mistral-judge,1.0,1.0,1.0,0.017341,6,346,True,True,The Proponent correctly identified the concept of the Gambler's Fallacy and provided an accurate explanation for why each coin flip is an independent event with no influence from previous results.,The Proponent correctly identified the concept of the Gambler's Fallacy and explained it in relation to the question about coin tosses. The Proponent also provided a clear analogy with drawing cards from a deck to further illustrate the independence of each event.,LPS=1.000: No significant fluency bias. The Judge rated both language conditions comparably.,2026-04-17T21:47:09
B_qwen_opp_llama_prop,S10,everyday physics,"If you are in a moving elevator that suddenly has its cable cut, would jumping just before it hits the ground save you, and why or why not?",qwen2.5-opponent,llama3.1-proponent,mistral-judge,0.95,0.95,1.0,0.903346,729,807,True,True,"The Proponent provided a detailed explanation of the physics involved when an elevator falls with a broken cable and a person jumps upwards just before impact. They demonstrated understanding of the concepts of acceleration, velocity, momentum, and deceleration, and used these to explain why jumping would not significantly reduce the impact force or time of contact.","The Proponent provided a detailed and accurate explanation of the physics involved in jumping from a moving elevator to reduce impact speed, and also explained why this reduction would not significantly improve safety in real-world scenarios due to factors such as buffering time and other variables.",LPS=1.000: No significant fluency bias. The Judge rated both language conditions comparably.,2026-04-17T21:49:51
